<?xml version="1.0" encoding="utf-8"?>
<Profiles xmlns:xsi="http://www.w3.org/2001/XMLSchema-instance" xsi:noNamespaceSchemaLocation="ProfilesSchema.xsd">
  <Entity-Profiles>
    <EntityProfile Name="SCEPRA_IPSec_EP">
      <Subject>
        <SubjectDN>
          <SubjectEntry>
            <Type>COMMON_NAME</Type>
            <Value>?</Value>
          </SubjectEntry>
          <SubjectEntry>
            <Type>ORGANIZATION_UNIT</Type>
            <Value>BUCI_DUAC_NAM</Value>
          </SubjectEntry>
          <SubjectEntry>
            <Type>ORGANIZATION</Type>
            <Value>ERICSSON</Value>
          </SubjectEntry>
          <SubjectEntry>
            <Type>COUNTRY_NAME</Type>
            <Value>SE</Value>
          </SubjectEntry>
        </SubjectDN>
      </Subject>
      <KeyGenerationAlgorithm>
        <Name>RSA</Name>
        <KeySize>2048</KeySize>
      </KeyGenerationAlgorithm>
      <CertificateProfileName>SCEPRA_IPsec_CP</CertificateProfileName>
      <TrustProfileName>IPSEC_NE_CHAIN_TP</TrustProfileName>
      <CertificateExtensions>
        <CertificateExtension xsi:type="KeyUsage">
          <Critical>true</Critical>
			<KeyUsageType>DIGITAL_SIGNATURE</KeyUsageType>
			<KeyUsageType>KEY_ENCIPHERMENT</KeyUsageType>
			<KeyUsageType>KEY_AGREEMENT</KeyUsageType>
        </CertificateExtension>
      </CertificateExtensions>
    </EntityProfile>
  </Entity-Profiles>
</Profiles>
